1032;Oatbits Biskuit Oat Raisin Kismis;Biskuit oat gandum;25;0;tepung terigu,oat,gula,minyak nabati,antioksidan kismis,glukosa,bubuk whey,bahan pengembang,natrium,amonium bikarbonat,kalsium,garam,pengemulsi lesitin kedelai,perisa Vanili,pewarna makanan tartrazin ci ;tepung terigu; oat; gula; minyak nabati antioksidan ; kismis; glukosa; bubuk whey; bahan pengembang natrium,amonium bikarbonat; kalsium; garam; pengemulsi lesitin kedelai; perisa vanila; pewarna makanan tartazin ci ;;;;;;;;;;;;;;;;;;;;;;;;
1033;Mister Potato Snack Crisps Roasted Beef;Roasted beef;25;0;kosong;kosong;;;;;;;;;;;;;;;;;;;;;;;;;;;;;;;;;;;;
1034;Pronas Corned Beef;Macaroni corned beef;25;0;daging sapi,terigu,protein kedelai,gula,bumbu,msg,polifosfat,nitrit;daging sapi; terigu; protein kedelai gula; bumbu; msg; polifosfat; nitrit;;;;;;;;;;;;;;;;;;;;;;;;;;;;;;
1035;Cip Corned Beef;Macaroni corned beef;25;0;kosong;kosong;;;;;;;;;;;;;;;;;;;;;;;;;;;;;;;;;;;;
1036;Cip Corned Beef;Macaroni corned beef;25;0;daging sapi pilihan;daging sapi pilihan;;;;;;;;;;;;;;;;;;;;;;;;;;;;;;;;;;;;
1037;Abc sardens Extra Pedas;Extra pedas;25;0;ikan sarden,saus cabai,penguat rasa mononatrium glutamat,gula,bawang putih,bawang bombay,garam,cabai rawit;ikan sarden ; saus cabai penguat rasa mononatrium glutamat; gula; bawang putih; bawang bombay; garam; cabai rawit;;;;;;;;;;;;;;;;;;;;;;;;;;;;;;
1038;Chitato Snack Potato Chips Ayam Barbeque;Ayam barbeque;25;0;kentang,minyak kelapa sawit,antioksidan tbhq,bumbu rasa ayam babeque,bubuk daging ayam,penguat rasa mononatrium glutamat,dinatrium inosinat,dinatrium guanilat,hidrolisa protein nabati;kentang; minyak kelapa sawit antioksidan tbhq; bumbu rasa ayam babeque bubuk daging ayam; penguat rasa mononatrium glutamat; dinatrium inosinat; dinatrium guanilat,hidrolisa protein nabati;;;;;;;;;;;;;;;;;;;;;;;;;;;;;;;
1039;Ensure Vanilla;Cendol babe vanilla;25;0;pati jagung terhidrolisa,natrium,kalsium kaseinat,sukrosa,minyak bunga matahari tinggi oleat,mineral,minyak kedelai,isolat protein kedelai,frukto-oligosakarida,inulin,isolat protein susu,minyak kanola,perisa artifisial Vanili,vitamin;pati jagung terhidrolisa; natrium,kalsium kaseinat; sukrosa; minyak bunga matahari tinggi oleat; mineral; minyak kedelai; isolat protein kedelai; fruktooligosakarida; inulin; isolat protein susu; minyak kanola; perisa artifasial vanila; vitamin;;;;;;;;;;;;;;;;;;;;;;;;
1040;Nabati Graker Biscuit Crackers Richoco;Nabati graker - graham crackers cokelat;25;0;kosong;kosong;;;;;;;;;;;;;;;;;;;;;;;;;;;;;;;;;;;;
1041;Tango Drink Berry Dremio Dreamy Strawberry;Aleka jelly drink strawberry;25;0;kosong;kosong;;;;;;;;;;;;;;;;;;;;;;;;;;;;;;;;;;;;
1042;Red Bull Gold Energy Drink Can;Gold taro bilani drink;25;0;taurine,caffeine,choline,inositol,lysine,vitamin b,provitamin b,vitamin b,vitamin b;taurine; caffeine; choline; inositol; lysine; vit b; provit b; vit b; vit b;;;;;;;;;;;;;;;;;;;;;;;;;;;;
1043;Mujigae Jajangmyeon;Jajangmyeon by mujigae;25;0;tepung terigu,minyak,garam,air,pasta kedelai hitam,kecap asin,bawang bombay,air,gula,garam,penyedap rasa,daging ayam,bawang bombay;mie tepung terigu; minyak; garam;,air saus pasta kedelai hitam; kecap asin; bawang bombay; air; gula; garam;,penyedap rasa topping daging ayam;,bawang bombay;;;;;;;;;;;;;;;;;;;;;;;;;;
1044;Abc sardens Chili;Abc tropical chili sauce;25;0;ikan sarden,saus cabai,cabai merah,gula,bawang putih,garam,bawang merah;ikan sarden ; saus cabai; cabai merah ; gula; bawang putih; garam; bawang merah;;;;;;;;;;;;;;;;;;;;;;;;;;;;;;
1045;Abc sardens Chili;Abc tropical chili sauce;25;0;ikan sardens,saus tomat,cabai merah,gula,bawang putih,garam,bawang merah;ikan sardens ; saus tomat; cabai merah ; gula; bawang putih; garam; bawang merah;;;;;;;;;;;;;;;;;;;;;;;;;;;;;;
1047;Piattos Premium Snack Kentang Sambal Geprek With Barbeque;Jack'njill piattos - makanan ringan kentang rasa sambal geprek;25;0;kosong;kosong;;;;;;;;;;;;;;;;;;;;;;;;;;;;;;;;;;;;
1048;Kratingdaeng Energy Drink Super;Energy drink;25;0;taurine mg,glucurolactore mg,cafeine mg,inositol mg,lysine mg,choroline bitartate mg,niacicinamide,vitamin b mg,pyrodoxine,vitamin b mg,dexpanthenol,provitamin b mg,cyanocobalamine,vitamin b mcg,sugar,gula murni g,procoaeu r ci,tartrazine ci,citric acid,sodium benzoate,flavouring;taurine mg; glucurolactore mg; cafeine mg; inositol mg; lysine mg; choroline bitartate mg; niacicinamide vitamin b mg; pyrodoxine vitamin b mg; dexpanthenol provitamin b mg; cyanocobalamine vitamin b mcg; sugar gula murni g; procoaeu r ci ; tartrazine ci ; citric acid; sodium benzoate  flavouring;;;;;;;;;;;;;;;;;;;;;;
1049;Carnation Kental Manis;Frisian flag susu kental manis;25;0;gula,air,minyak nabati,padatan susu,susu bubuk skim,bubuk whey,bubuk kakao,pemantap nabati  mineral,perisa artifisial cokelat,vitamin,antioksidan tokoferol;gula; air; minyak nabati; padatan susu susu bubuk skim; bubuk whey; bubuk kakao; pemantap nabati  mineral; perisa artifisial coklat;  vitamin antioksidan tokoferol;;;;;;;;;;;;;;;;;;;;;;;;;;;;
1050;Pada Suka Kue Phia 5'S Kacang Hitam;Phia kacang hitam;25;0;kosong;kosong;;;;;;;;;;;;;;;;;;;;;;;;;;;;;;;;;;;;
1052;Tango Drink Velluto Italian Choco;Gold choco love bilani drink;25;0;kosong;kosong;;;;;;;;;;;;;;;;;;;;;;;;;;;;;;;;;;;;
1053;Monde Biscuit Soft Pie Strawberi;Sumaco soft pie;25;0;tepung terigu,margarin,antioksidan bha,pewarna beta karoten ci,anato ci,kurkumin ci,lemak nabati,antioksidan bha,selai rasa stroberi,stroberi bubuk,pektin,pengatur keasaman,asam sitrat,pewarna merah allura ci,gula,garam;tepung terigu; margarin antioksidan bha,pewarna beta karoten ci ; anato ci ; kurkumin ci ; lemak nabati antioksidan bha; selai rasa stroberi stroberi bubuk; pektin; pengatur keasaman,asam sitrat; pewarna merah allura ci ; gula; garam;;;;;;;;;;;;;;;;;;;;;;;;;;
1054;Kraft Oreo Selection Biscuit Assorted;Bellagio biscuit  assorted;25;0;tepung terigu,gula,minyak nabati,antioksidan tbhq,bubuk cokelat,sirup fruktosa,pengembang,natrium,amonium bikarbonat,pati jagung,garam,pengemulsi,lesitin kedelai,perisa identik alami Vanili ;tepung terigu; gula; minyak nabati antioksidan tbhq; bubuk coklat; sirup fruktosa; pengembang natrium  amonium bikarbonat; pati jagung; garam; pengemulsi lesitin kedelai; perisa identik alami vanila ;;;;;;;;;;;;;;;;;;;;;;;;;;;
1057;Oatbits Oat8 Biscuit Havermout Kacang Ijo;Jus kacang ijo;25;0;gula,kacang hijau,Tepung Terigu,oat,minyak nabati,tepung telur,bahan pengembang amonium,bikarbonat,natrium bikarbonat,glukosa,kalsium karbonat,perisa artifisial kacang hijau,garam,pengemulsi lesitin kedelai;gula; kacang hijau ; teonug terigu; oat ; minyak nabati; tepung telur; bahan pengembang amonium; bikarbonat; natrium bikarbonat; glukosa; kalsium karbonat; perisa artifisial kacang hijau; garam; pengemulsi lesitin kedelai;;;;;;;;;;;;;;;;;;;;;;;
1058;Khong Guan Biscuit Red Segi Assorted;Khong guan biskuit marie;25;0;tepung terigu,lemak nabati,gula,susu bubuk,cokelat bubuk,pati jagung,sultana,mentega,keju bubuk,telur,garam,bahan pengembang,natrium bikarbonat,amonium bikarbonat,ragi,perisa,susu,cokelat,lemon,nanas,pewarna makanan,tartrazin ci ;tepung terigu; lemak nabati; gula; susu bubuk; coklat bubuk; pati jagung; sultana; mentega; keju bubuk; telur; garam; bahan pengembang natrium bikarbonat,amonium bikarbonat; ragi; perisa susu; coklat; lemon; nanas; pewarna makanan tartrazin ci ;;;;;;;;;;;;;;;;;;;
1059;Hijra Kurma Tunisia;Kurma;25;0;buah kurma;buah kurma;;;;;;;;;;;;;;;;;;;;;;;;;;;;;;;;;;;;
1060;Alpenliebe Candy Karamel Chocolate;Nutri-c chocolate candy;25;0;gula,cokelat hitam,sirup glukosa,susu kental manis,Dekstrosa,susu skim bubuk,garam,pengental nabati,perisa sintetik,minyak trgiguserida rantai se,g,maltodekstrin,minyak nabati,pengemulsi nabati;gula; cokelat hitam ; sirup glukosa; susu kental manis ; dektrosa; susu skim bubuk ; garam; pengental nabati; perisa sintetik; minyak trgiguserida rantai se,g; maltodekstrin; minyak nabati; pengemulsi nabati;;;;;;;;;;;;;;;;;;;;;;;;
1061;Glico Biscuit Pocky Colourful;Pocky almond;25;0;kosong;kosong;;;;;;;;;;;;;;;;;;;;;;;;;;;;;;;;;;;;
1062;East Bali Rosella Hibiscus Tea;Thai tea rosella;25;0;rosella,kering;rosella kering;;;;;;;;;;;;;;;;;;;;;;;;;;;;;;;;;;;;
1063;Lay's Snack Potato Chips Salmon Teriyaki;Salmon teriyaki;25;0;kentang,minyak kelapa sawit,bumbu rasa salmon teriyaki,penguat rasa mononatrium glutamat,dinatrium trosinat,dinatrium guanilat,antioksidan tbhq;kentang; minyak kelapa sawit; bumbu rasa salmon teriyaki penguat rasa mononatrium glutamat; dinatrium trosinat; dinatrium guanilat,antioksidan tbhq;;;;;;;;;;;;;;;;;;;;;;;;;;;;;;;;
1064;Indomaret Teng Teng Noga Kacang Wijen;Kacang atom indomaret;25;0;kacang,gula,wijen,garam;kacang; gula; wijen; garam;;;;;;;;;;;;;;;;;;;;;;;;;;;;;;;;;
1065;Kartika Toast Almond Bites;Silver queen bites almond;25;0;tepung terigu,gula kristal,air,kacang almond,mentega tawar,mentega,garam,susu evaporasi;tepung terigu; gula kristal; air; kacang almond; mentega tawar; mentega; garam; susu evaporasi;;;;;;;;;;;;;;;;;;;;;;;;;;;;;
1066;San Carlo Keripik Kentang Piu Gusto Lime;Keripik kentang laasania;25;0;kentang,minyak nabati,bumbu lemon,lada,gula,penguat rasa,mononatrium l-glutamat,ekstrak ragi,pengatur keasaman,natrium asetat,asam sitrat,kalium sitrat,lada bubuk,bawang merah bubuk,jeruk nipis bubuk,garam;kentang; minyak nabati; bumbu lemon,lada gula; penguat rasa mononatrium lglutamat; ekstrak ragi; pengatur keasaman,natrium asetat; asam sitrat; kalium sitrat; lada bubuk ;; bawang merah bubuk; jeruk nipis bubuk ;; garam;;;;;;;;;;;;;;;;;;;;;;;
1067;Lay's Snack Potato Chips Nori Seaweed;Dlala original potato chips;25;0;kentang,minyak kelapa sawit,bumbu rasa rumput laut,penguat rasa mononatrium glutamat,msg,dinatrium ribonukleotida,antioksidan tbhq;kentang; minyak kelapa sawit; bumbu rasa rumput laut penguat rasa mononatrium glutamat msg; dinatrium ribonukleotida,antioksidan tbhq;;;;;;;;;;;;;;;;;;;;;;;;;;;;;;;;;
1068;Lay's Snack Potato Chips Nori Seaweed;Dlala original potato chips;25;0;kentang,minyak olein kelapa sawit,perisa sintetik rumput laut,serpihan rumput laut;kentang ; minyak olein kelapa sawit; perisa sintetik rumput laut; serpihan rumput laut;;;;;;;;;;;;;;;;;;;;;;;;;;;;;;;;;
1069;Lay's Snack Potato Chips Nori Seaweed;Dlala original potato chips;25;0;kentang,minyak kelapa sawit,bumbu rasa rumput laut,ekstrak rumput laut,kedelai,gandum,ikan,penguat rasa mononatrium glutamat,dinatrium inosinat,dinatrium guanilat;kentang ;; minyak kelapa sawit; bumbu rasa rumput laut ekstrak rumput laut ; kedelai; gandum; ikan; penguat rasa mononatrium glutamat; dinatrium inosinat; dinatrium guanilat;;;;;;;;;;;;;;;;;;;;;;;;;;;
1070;Japota Potato Chips Umami Japanese Seaweed;Dlala original potato chips;25;0;kentang,minyak kelapa sawit,bumbu rasa rumput laut,garam,penguat rasa mononatrium glutamat,dinatrium inosinat,dinatrium guanilat,rumput laut,susu bubuk,bubuk ikan;kentang; minyak kelapa sawit; bumbu rasa rumput laut; garam; penguat rasa mononatrium glutamat; dinatrium inosinat,dinatrium guanilat; rumput laut; susu bubuk; bubuk ikan;;;;;;;;;;;;;;;;;;;;;;;;;;;;
1071;Orchid Butter;Butter blending;25;0;kosong;kosong;;;;;;;;;;;;;;;;;;;;;;;;;;;;;;;;;;;;
1072;Indomaret Tempura Seaweed;Seafood tempura seaweed;25;0;rumput laut,kulit tahu,tepung terigu,bumbu penyedap;rumput laut; kulit tahu; tepung terigu; bumbu penyedap;;;;;;;;;;;;;;;;;;;;;;;;;;;;;;;;;
1073;Hatari Jam Biscuit Peanut;Golite granola peanut butter,amp,jam;25;0;tepung terigu,gula,minyak tumbuh-tumbuhan,susu bubuk,tepung jagung,selai kacang,garam,pengembang amonium bikarbonat,natrium bikarbonat;tepung terigu; gula; minyak tumbuhtumbuhan; susu bubuk; tepung jagung; selai kacang; garam; pengembang amonium bikarbonat; natrium bikarbonat;;;;;;;;;;;;;;;;;;;;;;;;;;;;
1074;Anmum Susu Ibu Hamil Materna Strawberry White Chocolate;Lovamil ibu hamil strawberry;25;0;kosong;kosong;;;;;;;;;;;;;;;;;;;;;;;;;;;;;;;;;;;;
1075;22 Seafood Salmon Portion;Bola salmon,sunfish;25;0;kosong;kosong;;;;;;;;;;;;;;;;;;;;;;;;;;;;;;;;;;;;
1076;Khong Guan Crackers Saltcheese Barbeque;Jans bbq crackers;25;0;kosong;kosong;;;;;;;;;;;;;;;;;;;;;;;;;;;;;;;;;;;;
1077;Kraft Sandwich Oreo Coklat,Vanila;Selai coklat oreo;25;0;gula,tepung terigu,minyak nabati,antioksidan tbhq,bubukserbuk cokelat,sirup fruktosa,pati jagung,garam,pengembang,amonium,natrium bikarbonat,pengemulsi,lesitin kedelai,perisa Vanili;gula; tepung terigu; minyak nabati antioksidan tbhq; bubukserbuk coklat; sirup fruktosa; pati jagung; garam; pengembang amonium  natrium bikarbonat; pengemulsi lesitin kedelai; perisa vanilla;;;;;;;;;;;;;;;;;;;;;;;;;;;
1079;Taro Snack Potato Barbeque;Potato barbeque;25;0;tepung terigu,minyak nabati,tapioka,bumbu rasa kentang barbekyu,laktosa,penguat rasa msg,mononatrium glutamat,hidrolisa protein nabati,dinatrium inosinat,guanilat,rempah-rempah rempah,bubuk,perisa kentang,gula,garam,pengembang;tepung terigu; minyak nabati; tapioka; bumbu rasa kentang barbekyu laktosa; penguat rasa msg mononatrium glutamat; hidrolisa protein nabati; dinatrium inosinat,guanilat; rempahrempah; bubuk,perisa kentang; gula; garam; pengembang;;;;;;;;;;;;;;;;;;;;;;;;;
1080;Kusuka Cassava Snack Barbeque;Keripik talas barbeque merak;25;0;singkong,tepung beras,minyak kelapa sawit,tepung terigu,bumbu rasa barbeque,penguat rasa dinatrium inosinat,guanilat,mononatrium glutamat,antioksidan tokoferol,pewarna alami kurkumin ci,pemanis alami glikosida steviol,gula,garam;singkong; tepung beras; minyak kelapa sawit; tepung terigu; bumbu rasa barbeque; penguat rasa dinatrium inosinat  guanilat; mononatrium glutamat; antioksidan tokoferol; pewarna alami kurkumin cl ; pemanis alami glikosida steviol; gula,garam;;;;;;;;;;;;;;;;;;;;;;;;;;
1081;Stt French Fries 2000 Premium;French fries;25;0;tepung kentang,minyak sayur,oksidan,tbhq,gula garam,Penguat rasa mononatrium glutamat,bubuk bawang putih,bubuk bawang merah,bubuk merica,pewarna makanan tartrazin ci,pewarna makanan kuning fcf ci,air,gula,garam,cabai,bawang putih,tomat,penguat rasa mononatrium,glutamat,natrium benzoat,pewarna makanan tartrazin ci,kuning fcf ci ;tepung kentang; minyak sayur; oksidan,tbhq; gula garam; penguat rasamononatrium giutamet; bubuk bawang putih; bubuk bawang merah; bubuk merica; pewarna makanan tartrazin ci ; pewarna makanan kuning fcf ci ; sambal tomat  air; gula; garam; cabai; bawang putih; tomat; penguat rasa mononatrium; glutamat; pengawet makanan natrium benzoat; pewarna makanan tartrazin ci   kuning fcf ci ;;;;;;;;;;;;;;;;;
1082;Boncha Brick-O Cokelat Biskuit;Biskuit cokelat;25;0;kosong;kosong;;;;;;;;;;;;;;;;;;;;;;;;;;;;;;;;;;;;
1083;Cheetos Snack Puffs Cheddar Cheese;Amul processed cheddar cheese;25;0;tepung jagung,minyak kelapa sawit,bumbu rasa keju,gandum,padatan susu,penguat rasa mononatrium glutamat,dinatrium 'ribonukleotida,padatan keju,tepung jagung termodifikasi,pengemulsi kalsium karbonat,perisa identik alami keju,susu,gandum,penguat rasa dinatrium 'ribonukleotida;tepung jagung ; minyak kelapa sawit; bumbu rasa keju gandum; padatan susu; penguat rasa mononatrium glutamat; dinatrium ribonukleotida; padatan keju ; tepung jagung termodifikasi; pengemulsi kalsium karbonat; perisa identik alami keju susu; gandum; penguat rasa dinatrium ribonukleotida;;;;;;;;;;;;;;;;;;;;;;;;;
1084;Delfi Custas Soft Cup Cake Orion;Cup cake buttercream;25;0;telur,tepung terigu,gula,minyak sayur,lemak nabati,sirup isomalto oligosakarida,sirup maltosa,sirup fruktosa,susu bubuk,bubuk kuning telur,maltodekstrin,pengemulsi nabati,mo,digliserida asam lemak,lesitin kedelai,esterpoligliserol asam risinoleat terinteresterifikasi,penstabil,kalsium karbonat,gom xanthan,hidroksipropil dipati fostfat,garam,perisa sintetik,Vanili,custard,pengawet,kalium sorbat,natrium propionat,pengembang;telur; tepung terigu; gula; minyak sayur; lemak nabati; sirup isomalto oligosakarida; sirup maltosa; sirup fruktosa; susu bubuk ;; bubuk kuning telur; maltodekstrin; pengemulsi nabati mono,digliserida asam lemak; lesitin kedelai; esterpoligliserol asam risinoleat terinteresterifikasi; penstabil kalsium karbonat; gom xanthan; hidroksipropil dipati fostfat; garam; perisa sintetik vanilla,custard; pengawet kalium sorbat,natrium propionat; pengembang;;;;;;;;;;;;;;;
1085;Indomaret Rengginang;Nh rengginang;25;0;beras ketan putih,u,g,garam,bawang putih,penguat rasa mononatrium glutamat,minyak sawit;beras ketan putih; u,g; garam; bawang putih; penguat rasa mononatrium glutamat; minyak sawit;;;;;;;;;;;;;;;;;;;;;;;;;;;;;;;
1086;Khong Guan Crackers Saltcheese Regular;Jans bbq crackers;25;0;tepung terigu,lemak nabati,susu bubuk,garam,ragi,soda kue,tepung keju;tepung terigu; lemak nabati; susu bubuk; garam; ragi; soda kue; tepung keju;;;;;;;;;;;;;;;;;;;;;;;;;;;;;;
1087;5 Days Croissant Chocolate;Croissant chocolate;25;0;tepung terigu,pasta cokelat, air,margarin,pengawet kalium sorbat,antioksidan tokoferol,pewarna makanan alami beta karoten ci,no  gula icing,ragi,susu bubuk sirup jagung tinggi fruktosa,pengemulsi nabati,pemanis alami sorbitol,pewarna makanan sintetik juning fcf ci bha pati jagung,pengawet sulfit garam,perisa sintetik mentega susu pengemulsi nabati,askorbat pengawet kalsium propionat,pengatur keasaman,asam sitrat;tepung terigu; pasta cokelat  air; margarin pengawet kalium sorbat; antioksidan tokoferol; pewarna makanan alami beta karoten cl; no  gula icing; ragi; susu bubuk sirup jagung tinggi fruktosa; pengemulsi nabati pemanis alami sorbitol; pewarna makanan sintetik juning fcf ci bha pati jagung pengawet sulfit garam; perisa sintetik mentega susu pengemulsi nabati,askorbat pengawet kalsium propionat; pengatur keasaman,asam sitrat;;;;;;;;;;;;;;;;;;;;;;;;;
1088;Khong Guan Crackers+Wafer Saltcheese Combo;Jans combo cheez;25;0;tepung terigu,gula,lemak nabati,susu bubuk,cokelat bubuk,keju bubuk,pati jagung,garam,pengembang,natrium bikarbonat,amonium bikarbonat;tepung terigu; gula; lemak nabati; susu bubuk; coklat bubuk; keju bubuk; pati jagung; garam; pengembang natrium bikarbonat,amonium bikarbonat;;;;;;;;;;;;;;;;;;;;;;;;;;;;
1089;Taro Snack Seaweed;Gurih-ya seaweed;25;0;tepung terigu,minyak nabati,tapioka,bumbu rasa rumput laut,penguat rasa mononatrium glutamat,dinatrium inosinat,guanilat,rumput laut kering,perisa identik alami rumput laut,hidrolisa protein nabati,pewarna karamel kelas ie a,gula,garam,pengembang;tepung terigu; minyak nabati; tapioka; bumbu rasa rumput laut penguat rasa mononatrium glutamat; dinatrium inosinat,guanilat; rumput laut kering; perisa identik alami rumput laut; hidrolisa protein nabati; pewarna karamel kelas ie a; gula; garam; pengembang;;;;;;;;;;;;;;;;;;;;;;;;;
1090;Krisbee Snack Pillow Choco Lava;Emmh snack choco milk;25;0;cokelat pasta,padatan susu,kakao bubuk,pasta kacang hazel,perisa sintetik,pemanis alami,tepung terigu,beras,pewarna cokelat;cokelat pasta; padatan susu; kakao bubuk; pasta kacang hazel; perisa sintetik; pemanis alami; tepung terigu; beras; pewarna cokelat;;;;;;;;;;;;;;;;;;;;;;;;;;;;
1091;Khong Guan Crackers Saltcheese Combociz;Jans bbq crackers;25;0;tepung terigu,gula,lemak nabati,keju bubuk,pewarna makanan,tartrazin ci,kuning fcf,ci-,susu bubuk,cokelat bubuk,garam,pati jagung,Bahan Pengembang,natrium bikarbonat,amonium bikarbonat;tepung terigu; gula; lemak nabati; keju bubuk pewarna makanan tartrazin ci,kuning fcf ci; susu bubuk; coklat bubuk; garam; pati jagung; bahan pengemnang natrium bikarbonat,amonium bikarbonat;;;;;;;;;;;;;;;;;;;;;;;;;;;;
1092;Khong Guan Crackers Saltcheese Combociz;Jans bbq crackers;25;0;kosong;kosong;;;;;;;;;;;;;;;;;;;;;;;;;;;;;;;;;;;;
1093;Kartika Toast Soesnack Chocolate;Toast chocolate;25;0;kosong;kosong;;;;;;;;;;;;;;;;;;;;;;;;;;;;;;;;;;;;
1094;San Carlo Keripik Kentang Piu Gusto Paprika;Keripik kentang laasania;25;0;kentang,minyak nabati,bumbu rasa paprika,paprika,whey bubuk,penguat rasa mononatrium glutamat;kentang; minyak nabati; bumbu rasa paprika  paprika ;; whey bubuk; penguat rasa mononatrium glutamat;;;;;;;;;;;;;;;;;;;;;;;;;;;;;;;
1096;Sie/Kim Teng-Teng;Teng-teng merk niasa;25;0;kacang tanah,gula pasir;kacang tanah; gula pasir;;;;;;;;;;;;;;;;;;;;;;;;;;;;;;;;;;;
1097;Dilmah Greean Tea Jasmine Petals 20's Envelope;Dilmah tea jasmine,sjg;25;0;teh hijau,ekstrak melati,perisa melati;teh hijau; ekstrak melati,perisa melati;;;;;;;;;;;;;;;;;;;;;;;;;;;;;;;;;;;
1098;Big Babol Candy Stick Blueberry;Stick roll cheese;25;0;gula,gum base,antioksidan bht,sirup glukosa,humektan,gliserol,triaseyin,pengatur keasaman,asam sitrat,asam tartrat,perisa sintetik,ekstrak blueberry,pewarna biru berlian ci,merah allura ci;gula; gum base antioksidan bht; sirup glukosa; humektan gliserol; triaseyin; pengatur keasaman,asam sitrat; asam tartrat; perisa sintetik; ekstrak blueberry ; pewarna biru berlian ci; merah allura ci;;;;;;;;;;;;;;;;;;;;;;;;;;
1099;Kraft Sandwich Oreo Chocolate Creme;Oreo chocolate cream-chocolate  sandwich cookies with chocolate cream;25;0;gula,tepung terigu,minyak nabati,antioksidan tbhq,bubukserbuk cokelat,sirup fruktosa,pati jagung,garam,pengembang,amonium,natrium bikarbonat,pengemulsi,lesitin kedelai,perisa Vanili;gula; tepung terigu; minyak nabati antioksidan tbhq; bubukserbuk coklat; sirup fruktosa; pati jagung; garam; pengembang amonium  natrium bikarbonat; pengemulsi lesitin kedelai; perisa vanilla;;;;;;;;;;;;;;;;;;;;;;;;;;;
1100;Chitato Snack Potato Chips Ayam Bumbu;Dlala original potato chips;25;0;kentang,minyak kelapa sawit,bumbu rasa ayam berempah rempah,penguat rasa mononatrium glutamat,dinatrium inosinat,dinatrium guanilat,hidrolisa protein nabati,pewarna makanan karamel,tartrazin ci,antioksidan tbhq;kentang; minyak kelapa sawit; bumbu rasa ayam berempah penguat rasa mononatrium glutamat; dinatrium inosinat; dinatrium guanilat; hidrolisa protein nabati; pewarna makanan karamel; tartrazin ci,antioksidan tbhq;;;;;;;;;;;;;;;;;;;;;;;;;;;;;
1101;Happytos Snack Tortila Chips Hijau;Rempeyek kacang hijau;25;0;jagung murni;jagung murni;;;;;;;;;;;;;;;;;;;;;;;;;;;;;;;;;;;;
1102;Kit Kat Chocolate 4 Fingers;Nestle kit kat mini milk chocolate;25;0;gula,susu bubuk full cream,tepung terigu,kakao massa,lemak,minyak nabati,bubuk kakao,pengemulsi lesitin kedelai,makanan ragi,pengembang natrium bikarbonat,garam,pengembang kalsium karbonat,ragi,perisa Vanili;gula; susu bubuk full cream; tepung terigu; kakao massa; lemak,minyak nabati; bubuk kakao; pengemulsi lesitin kedelai; makanan ragi; pengembang natrium bikarbonat; garam; pengembang kalsium karbonat; ragi; perisa vanilin;;;;;;;;;;;;;;;;;;;;;;;;
1103;Selma Pumpkin Seeds;Pumpkin seeds,topping;25;0;kosong;kosong;;;;;;;;;;;;;;;;;;;;;;;;;;;;;;;;;;;;
1104;Happytos Snack Tortila Chips Merah;Snack citos beras merah;25;0;jagung murni,garam;jagung murni; garam; tanpa bahan pengawet;;;;;;;;;;;;;;;;;;;;;;;;;;;;;;;;;;
1105;Roma Biscuit Susu+Selai Slai O'lai Blueberry;Roma slai o lai blueberry;25;0;tepung terigu,minyak nabati,gula,glukosa,fruktosa,gliserin,puree apel,susu bubuk,garam,pengemulsi lesitin kedelai,pengatur keasaman,penstabil nabati,pengembang,kalsium karbonat,konsentrat bluberi,perisa sintetik,pewarna makanan,premiks vitamin;tepung terigu; minyak nabati; gula; glukosa; fruktosa; gliserin; puree apel; susu bubuk; garam; pengemulsi lesitin kedelai; pengatur keasaman; penstabil nabati; pengembang; kalsium karbonat; konsentrat bluberi; perisa sintetik; pewarna makanan; premiks vitamin;;;;;;;;;;;;;;;;;;;
1106;Hampton Shortbread Pure Butter Chocolate;Chocolate almond butter nichoa chocolate;25;0;tepung terigu,mentega,gula pasir,cokelat chip,maizena,susu skim,garam;tepung terigu; mentega; gula pasir; coklat chip; maizena; susu skim; garam;;;;;;;;;;;;;;;;;;;;;;;;;;;;;;
1107;S-26 Procal Susu Bubuk Pertumbuhan 3 Vanilla;Frisian flag susu bubuk rasa vanilla;25;0;kosong;kosong;;;;;;;;;;;;;;;;;;;;;;;;;;;;;;;;;;;;
1108;Pon,Brownies Kukus / Panggang Chocolate; brownies kukus;25;0;kosong;kosong;;;;;;;;;;;;;;;;;;;;;;;;;;;;;;;;;;;;
1109;,cow Fortigro Susu Bubuk Instant Polybag;Milko susu bubuk instant rasa original;25;0;padatan susu,susu sapi,susu bubuk skim,lemak susu,maltodekstrin,minyak nabati,mineral,perisa identik alami,pengemulsi lesitin kedelai,premiks vitamin;padatan susu susu sapi; susu bubuk skim; lemak susu; maltodekstrin; minyak nabati;  mineral; perisa identik alami; pengemulsi lesitin kedelai,premiks vitamin;;;;;;;;;;;;;;;;;;;;;;;;;;;;;
1110;Gery Snack Sereal;Sereal;25;0;gula,minyak nabati,cokelat bubuk,tepung terigu,Dekstrosa monohidrat,lemak reroti,antioksidan bha,susu bubuk,whey bubuk,tepung tapioka,pewarna karamel e,pewarna karamel e d,pengemulsi lesitin kedelai,garam,perisa artifisial Vanili;gula; minyak nabati; cokelat bubuk; tepung terigu; dextrosa monohidrat; lemak reroti antioksidan bha; susu bubuk; whey bubuk; tepung tapioka; pewarna karamel e  d; pengemulsi lesitin kedelai; garam; perisa artifisial vanilla;;;;;;;;;;;;;;;;;;;;;;;;
1111;Japota Potato Chips Happy Honey Butter;Dlala original potato chips;25;0;kentang,minyak kelapa sawit,bumbu rasa madu mentega;kentang; minyak kelapa sawit; bumbu rasa madu mentega;;;;;;;;;;;;;;;;;;;;;;;;;;;;;;;;;;
1112;Serena Caramelised Biscuit Troy;Pink biscuit;25;0;kosong;kosong;;;;;;;;;;;;;;;;;;;;;;;;;;;;;;;;;;;;
1113;Bihophar Acacia Honey;Makuka honey;25;0;kosong;kosong;;;;;;;;;;;;;;;;;;;;;;;;;;;;;;;;;;;;
1114;Enam Tiga Premium Tea 20's Assorted;Ocha;25;0;teh oolong,teh oolong,melati,teh hitam,teh hijau;teh oolong; teh oolong  melati; teh hitam; teh hijau;;;;;;;;;;;;;;;;;;;;;;;;;;;;;;;;;
1119;Anmum Susu Bubuk Ibu Hamil Materna Strawberry White Cokelat;Lovamil ibu hamil strawberry;2,30769E+15;0;susu bubuk tanpa lemak,susu bubuk,sukrosa,serat pangan inulin,lemak susu,kalsium karbonat,premiks mineral,bubuk dha,perisa sintetik stroberi,cokelat putih,premiks vitamin,bubuk stroberi,pewarna alami karmin clno;susu bubuk tanpa lemak; susu bubuk; sukrosa; serat pangan inulin; lemak susu; kalsium karbonat; premiks mineral; bubuk dha; perisa sintetik stroberi; cokelat putih; premiks vitamin; bubuk stroberi; pewarna alami karmin clno;;;;;;;;;;;;;;;;;;;;;;;;
