497;Indomie Mi Instan Ayam Bawang;Gaga seribu mi instan rasa ayam bawang;3,63636E+15;0;tepung terigu,minyak sayur,tepung tapioka,garam,pemantap,nabati,natrium tripolifosfat,pengatur keasaman,mineral,zat besi,pewarna,tartrazin ci,antioksidan tbhq,garam,gula,penguat rasa mononatrium glutamat,msg,perisa ayam,pewarna penguat rasa ribotida,bubuk bawang putih,perisa bawang bombay,bubuk lada,daun bawang,vitamin a,vitamin b,vitamin b,vitamin b,niasin,asam folat,pantotenat,bubuk cabai,minyak sayur,bawang merah;mi tepung terigu; minyak sayur; tepung tapioka; garam; pemantap nabati,natrium tripolifosfat; pengatur keasaman; mineral zat besi; pewarna tartrazin ci ; antioksidan tbhq bumbu garam; gula; penguat rasa mononatrium glutamat msg; perisa ayam pewarna penguat rasa ribotida; bubuk bawang putih; perisa bawang bombay; bubuk lada; daun bawang; vitamin a;b; b; b; niasin; asam folat; pantotenat,bubuk cabe minyak minyak sayur,bawang merah;;;;;;;;;;;;;;
501;Hatari Crackers See Hong Puff Sugar;See hong puff malkist crackers;3,63636E+15;0;tepung terigu,tepung tapioka,tepung susu,minyak tumbuh-tumbuhan,garam,gula,ragi,amonium bikarbonat;tepung terigu; tepung tapioka; tepung susu; minyak tumbuhtumbuhan; garam; gula; ragi; amonium bikarbonat;;;;;;;;;;;;;;;;;;;;;;;;;;;;;
504;Cap Enaak Kental Manis Coklat;Krimer kental manis cokelat  - cap enaak pouch;3,63636E+15;0;gula,Susu Sapi,minyak nabati,bubuk whey,bubuk cokelat,maltodekstrin,buttermilk bubuk,air,susu bubuk skim,perisa identik alami,pewarna alami karamel,garam,laktosa,penstabil nabati,antioksidan tokoferol,vitamin a,vitamin b,kolin,vitamin d;gula; susu sapi segar; minyak nabati; bubuk whey; bubuk cokelat; maltodekstrin; buttermilk bubuk; air; susu bubuk skim; perisa identik alami pewarna alami karamel; garam; laktosa; penstabil nabati; antioksidan tokoferol; vitamin a; b; kolin,vitamin d;;;;;;;;;;;;;;;;;;;;
505;Olivoila Olive Oil Extra Virgin;Tropicana slim extra virgin olive oil;3,63636E+15;0;kosong;kosong;;;;;;;;;;;;;;;;;;;;;;;;;;;;;;;;;;;;
513;Maya sardens Tomato,Chili Sauce;Pasific sardens in tomato,amp,chili sauce;3,63636E+15;0;kosong;kosong;;;;;;;;;;;;;;;;;;;;;;;;;;;;;;;;;;;;
515;Torabika Cappuccino Extra Choco Granule;Kopiko grande cappuccino with choco granule;3,63636E+15;0;gula,krimer,kopi instant,cokelat granula,susu bubuk skim,ekstrak malt,perisa artifisial;gula; krimer; kopi instant; cokelat granula susu bubuk skim,ekstrak malt; perisa artifisial;;;;;;;;;;;;;;;;;;;;;;;;;;;;;;;;
516;Good Day Kopi Instant 3 In 1 Mocacinno;Kopi hijrah sachet 3 in 1;3,63636E+15;0;kopi instant,gula,krim nabati,perasa mocca;kopi instant; gula; krim nabati; perasa mocca;;;;;;;;;;;;;;;;;;;;;;;;;;;;;;;;;
522;Gadjah Kopi Tubruk Manis 2 In 1;Kopi bubuk 2 in 1 senang;3,63636E+15;0;kopi bubuk ;kopi bubuk ;;;;;;;;;;;;;;;;;;;;;;;;;;;;;;;;;;;;
523;Samyang Mie Instant Goreng Pedas Ayam Carbonara;Mie goreng ayam asam pedas;3,63636E+15;0;tepung gandum,pati tapioka termodifikasi,minyak goreng kelapa sawit,pati kentang termodifikasi,tepung gluten,garam,ekstra bawang bombay,pengatur keasaman,asam sitrat,penstabil gom guar,pewarna riboflavin,perisa alami teh hijau,air,bumbu rasa ayam,kecap gula,lada merah,ekstrak cabai,minyak kedelai,bawang bombay,bawang putih,pati kentang termodifikasi,ekstrak paprika,lada hitam bubuk,kari bubuk,bumbu rasa kari ayam,susu bubuk,gula,garam;mi tepung gandum; pati tapioka termodifikasi; minyak goreng kelapa sawit; pati kentang termodifikasi; tepung gluten; garam; ekstra bawang bombay; pengatur keasaman,asam sitrat; penstabil gom guar; pewarna riboflavin; perisa alami teh hijau bumbu soup air; bumbu rasa ayam; kecap gula; lada merah; ekstrak cabe; minyak kedelai; bawang bombay; bawang putih; pati kentang termodifikasi; ekstrak paprika; lada hitam bubuk; kari bubuk; bumbu rasa kari ayam bumbu serbuk susu bubuk; gula; garam;;;;;;;;;;;;
534;Bertolli Olive Oil Extra Virgin;Tropicana slim extra virgin olive oil;3,63636E+15;0;kosong;kosong;;;;;;;;;;;;;;;;;;;;;;;;;;;;;;;;;;;;
535;Bertolli Olive Oil Extra Virgin;Tropicana slim extra virgin olive oil;3,63636E+15;0;minyak zaitun;minyak zaitun;;;;;;;;;;;;;;;;;;;;;;;;;;;;;;;;;;;;
541;Ayam Brand Mackerel In Tomato Bulat;Ayam belanda  brand canned mackerel in tomato sauce;3,57143E+16;0;kosong;kosong;;;;;;;;;;;;;;;;;;;;;;;;;;;;;;;;;;;;
542;Ayam Brand sardens In Tomato Bulat;Ayam belanda  brand canned sardens in tomato sauce;3,57143E+16;0;kosong;kosong;;;;;;;;;;;;;;;;;;;;;;;;;;;;;;;;;;;;
544;Nutrijell Konnyaku Jelly Powder Melon;Puding melon powder jelly;3,33333E+15;0;keragenan,konnyaku bubuk,gula,pengatur keasaman,asam,kalium sitrat,asam sitrat,serat pangan frukto oligasakarida,kalsium,vitamin d,perisa melon,pewarna makanan,tartrazin ci,biru berlian ci ;keragenan; konnyaku bubuk; gula; pengatur keasaman,asam kalium sitrat; asam sitrat; serat pangan frukto oligasakarida; kalsium; vitamin d; perisa melon; pewarna makanan tartrazin ci ; biru berlian ci ;;;;;;;;;;;;;;;;;;;;;;;;;;
545;Nutrijell Konnyaku Jelly Powder Strawberry;Puding strawberry powder jelly;3,33333E+15;0;keragenan,konnyaku bubuk,gula,pengatur keasaman,asam,kalium sitrat,asam sitrat,serat pangan frukto oligasakarida,kalsium,vitamin d,perisa Stroberi,pewarna makanan karmoisin ci,;keragenan; konnyaku bubuk; gula; pengatur keasaman,asam kalium sitrat; asam sitrat; serat pangan frukto oligasakarida; kalsium; vitamin d; perisa strawberry; pewarna makanan karmoisin ci ;;;;;;;;;;;;;;;;;;;;;;;;;;;
550;Indomilk Kental Manis Chocolate;Miki chocolate susu kental manis;3,33333E+15;0;gula,Susu Sapi,minyak nabati,bubuk whey,bubuk cokelat,buttermilk bubuk,maltodekstrin,air,susu bubuk skim,perisa identik alami,pewarna alami karamel e c,d,garam,laktosa,penstabil nabati,antioksidan tokoferol,vitamin a,b,kolin,vitamin d;gula; susu sapi segar; minyak nabati; bubuk whey; bubuk coklat; buttermilk bubuk; maltodekstrin; air; susu bubuk skim; perisa identik alami pewarna alami karamel e c;d; garam; laktosa; penstabil nabati; antioksidan tokoferol; vitamin a; b; kolin,vitamin d;;;;;;;;;;;;;;;;;;;
552;Buavita Juice Slim Jambu;Juice jambu;3,33333E+15;0;air,buah jambu,sukrosa,perisa jambu,vitamin c,garam,pewarna alami karmin,ci,pengatur keasaman,asam sitrat,pemantap nabati,vitamin a;air; buah jambu; sukrosa; perisa jambu; vitamin c; garam; pewarna alami karmin ci ; pengatur keasaman,asam sitrat; pemantap nabati; vitamin a;;;;;;;;;;;;;;;;;;;;;;;;;;;
555;Mentos Candy Mint;Mayora mint candy;3,33333E+15;0;gula,sirup glukosa,minyak nabati,tepung beras,pengental,gom arab,gom gellant,perisa,mint,pengemulsi,ester sukrosa,asam lemak,pelapis,karnauba wax;gula; sirup glukosa; minyak nabati; tepung beras; pengental gom arab; gom gellant; perisa  mint; pengemulsi  ester sukrosa asam lemak; pelapis  karnauba wax;;;;;;;;;;;;;;;;;;;;;;;;;;;;
556;Abc Juice Kacang Hijau;Kacang hijau;3,33333E+15;0;sari kacang hijau,gula,air,gula kelapa,Premiks mineral,daun pan,jahe,Premiks vitamin,garam,pengatur keasaman;sari kacang hijau ; gula; air; gula kelapa; premix mineral; daun pan,; jahe; premix vitamin; garam,pengatur keasaman;;;;;;;;;;;;;;;;;;;;;;;;;;;;
557;Garuda Snack Pilus Pedas;Gita pilus pedas;3,33333E+15;0;tepung tapioka,minyak nabati,saos sambal,garam,bawang putih,penguat rasa mononatrium glutamat,gula pemanis buatan,asesulfam-k,adi,aspartam,adi,pewarna makanan,tartrazin ci,ponceau r ci ;tepung tapioka; minyak nabati; saos sambal; garam; bawang putih; penguat rasa mononatrium glutamat; gula pemanis buatan asesulfamk mgsaji  adi  mgkg berat ba,; aspartam mgsaji  adi  mgkg berat ba,; pewarna makanan tartrazin ci ; ponceau r ci ;;;;;;;;;;;;;;;;;;;;;;;;;;;
558;Kurma Fresh;Kurma;3,33333E+15;0;kosong;kosong;;;;;;;;;;;;;;;;;;;;;;;;;;;;;;;;;;;;
560;Floridina Juice Pulp Orange;Juice orange;3,33333E+15;0;air,gula,bulir jeruk,konsentrat jeruk,perisa jeruk,pengatur keasaman,asam sitrat,natrium sitrat,vitamin c,pewarna natural;air; gula; bulir jeruk ; konsentrat jeruk ; perisa jeruk; pengatur keasaman,asam sitrat; natrium sitrat; vitamin c,pewarna natural;;;;;;;;;;;;;;;;;;;;;;;;;;;;;
562;Indomaret Keripik Kelapa Fresh Milk;Keripik kelapa;3,33333E+15;0;kelapa,gula tebu,sirup singkong,susu bubuk,garam,perisa Vanili;kelapa; gula tebu; sirup singkong; susu bubuk; garam; perisa vanila;;;;;;;;;;;;;;;;;;;;;;;;;;;;;;;
565;Kobe Tepung Bumbu Putih;Bumbu putih umay;3,33333E+15;0;tapioca flour,rice flour,flavour enhancer,mononatrium l-Glutamat,dinatrium ' - Inosinat,dinatrium ' - Guanilat,Garam,white pepper powder,nutrneg essential oil,;tapioca flour ; rice flour ; flavour enhancer mononatrium lglutamate  ; dinatrium   inosinate   ; dinatrium   guanylate; salt ; white pepper powder ; nutrneg essential oil ;;;;;;;;;;;;;;;;;;;;;;;;;;;;;
566;Kikkoman Saus Bulgogi;Saus bulgogi;3,33333E+15;0;kosong;kosong;;;;;;;;;;;;;;;;;;;;;;;;;;;;;;;;;;;;
567;Indomaret Keripik Kelapa Brown Sugar;Keripik kelapa;3,33333E+15;0;kelapa,gula tebu,gula aren,garam;kelapa; gula tebu; gula aren; garam;;;;;;;;;;;;;;;;;;;;;;;;;;;;;;;;;
568;Delmonte Whole Kernel Corn Fresh Cut;Whole kernel sweet corn,daily fresh;3,33333E+15;0;kosong;kosong;;;;;;;;;;;;;;;;;;;;;;;;;;;;;;;;;;;;
569;Indomaret Snack Kue Dolar;Kue kaktus;3,33333E+15;0;tepung beras,gula,tepung sagu,kacang tanah,santan,telur,wijen;tepung beras; gula; tepung sagu; kacang tanah; santan; telur; wijen;;;;;;;;;;;;;;;;;;;;;;;;;;;;;;
570;Huwi Silky Pudding Mango;Premix silky pudding - mango;3,33333E+15;0;kosong;kosong;;;;;;;;;;;;;;;;;;;;;;;;;;;;;;;;;;;;
571;Huwi Silky Pudding Chocolate;Premix silky pudding - chocolate;3,33333E+15;0;kosong;kosong;;;;;;;;;;;;;;;;;;;;;;;;;;;;;;;;;;;;
572;Huwi Silky Pudding Strawberry;Huwi silky pudding rasa cokelat;3,33333E+15;0;kosong;kosong;;;;;;;;;;;;;;;;;;;;;;;;;;;;;;;;;;;;
579;Lovy Butter Cookies Coffeeccino;Clarinta cookies;3,33333E+15;0;kosong;kosong;;;;;;;;;;;;;;;;;;;;;;;;;;;;;;;;;;;;
580;Nissin Mie Goreng Gekikara Ramen Pedas;Mie goreng pedas;3,33333E+15;0;tepung,minyak nabati,tapioka,garam,penstabil,pengatur keasaman,gula,penguat rasa,garam,bubuk cabai,hidrosilat protein nabati,bubul bawang merah,bubuk bawang putih,bubuk jamur,bubuk lada putih,bubuk lada hitam,pewarna,perisa identik alami,bubuk jahe,minyak nabati,minyak bawang putih,minyak atsiri paprika,minyak cabai,wortel,daun bawang,jamur kering,cabai kering,gula aren,ekstrak kedelai,air,garam,kriuk bawang ;mi tepung; minyak nabati; tapioka; garam; penstabil; pengatur keasaman,bumbu gula; penguat rasa; garam; bubuk cabe; hidrosilat protein nabati; bubul bawang merah; bubuk bawang putih; bubuk jamur; bubuk lada putih; bubuk lada hitam; pewarna; perisa identik alami,bubuk jahe minyak minyak nabati; minyak bawang putih; minyak atsiri paprika,minyak cabe sayuran kering wortel; daun bawang; jamur kering; cabe kering kecap manis gula aren; ekstrak kedelai; air; garam kriuk bawang ;;;;;;;;;;;;
584;Agar Rasa Agar Agar Powder Coklat;Samson custard powder rasa coklat;3,33333E+15;0;cokelat bubuk,agar bubuk,karagen,konnyaku bubuk,susu bubuk,pengatur keasaman,kalium sitrat,gula;coklat bubuk; agar bubuk; karagenan; konnyaku bubuk; susu bubuk; pengatur keasaman,kalium sitrat; gula;;;;;;;;;;;;;;;;;;;;;;;;;;;;;;
589;Nextar Nastar Cookies Brownies;Cookies nastar lingi;3,33333E+15;0;tepung terigu,gula,lemak nabati,cokelat bubuk,dekstrosa,penstabil gliserin,gula aren,maltodekstrin,garam,pengembang natrium bikarbonat,pengemulsi lesitin kedelai,perisa sintetik Vanili,pengawet kalium sorbat;tepung terigu; gula; lemak nabati; cokelat bubuk ; dekstrosa; penstabil gliserin; gula aren; maltodekstrin; garam; pengembang natrium bikarbonat; pengemulsi lesitin kedelai; perisa sintetik vanila; pengawet kalium sorbat;;;;;;;;;;;;;;;;;;;;;;;;
591;Buavita Juice Mini Orange;Juice orange;3,33333E+15;0;air,sari buah jeruk dengan bulir jeruk,sari buah apel,sukrosa,maltodekstrin,penstabil nabati,perisa sintetik jeruk,pengatur keasaman,vitamin c,pewarna alami beta karoten,pemanis alami glikosida steviol,vitamin a;air; sari buah jeruk dengan bulir jeruk; sari buah apel; sukrosa; maltodekstrin; penstabil nabati; perisa sintetik jeruk; pengatur keasaman; vitamin c; pewarna alami beta karoten; pemanis alami glikosida steviol,vitamin a;;;;;;;;;;;;;;;;;;;;;;;;;;
592;Diamond Juice Unsweet Orange;Juice orange;3,33333E+15;0;air,konsentrat jeruk,penstabil nabati,pengatur keasaman,asam sitrat,perisa alami jeruk;air; konsentrat jeruk; penstabil nabati; pengatur keasaman,asam sitrat; perisa alami jeruk;;;;;;;;;;;;;;;;;;;;;;;;;;;;;;;;
593;Indomaret Bumbu Biji Kemiri;Bumbu kemiri;3,33333E+15;0;kosong;kosong;;;;;;;;;;;;;;;;;;;;;;;;;;;;;;;;;;;;
594;Mr.P Kacang Madu;Kacang mede madu;3,33333E+15;0;kacang,garam,madu,minyak nabati,gula halus;kacang; garam; madu; minyak nabati; gula halus;;;;;;;;;;;;;;;;;;;;;;;;;;;;;;;;
595;Cy Double Hot Chocolate Drink;Buybest hot chocolate drink;3,33333E+15;0;gula,krimer,bubuk kakao,penstabil,pengemulsi;gula; krimer; bubuk kakao; penstabil  pengemulsi;;;;;;;;;;;;;;;;;;;;;;;;;;;;;;;;;
596;Chocolatos Wafer Roll Mini;Mini roll brownis;3,33333E+15;0;kosong;kosong;;;;;;;;;;;;;;;;;;;;;;;;;;;;;;;;;;;;
598;Oishi Snack Pillows Chocolate;Emmh snack chocolate;3,33333E+15;0;gula,tepung terigu,beras,minyak nabati,antioksidan tbhq,susu bubuk,cokelat bubuk,bubuk whey,garam,pengemulsi,lesitin kedelai,perisa cokelat,vanili;gula; tepung terigu; beras; minyak nabati antioksidan tbhq; susu bubuk; coklat bubuk; bubuk whey; garam; pengemulsi lesitin kedelai; perisa coklat,vanili;;;;;;;;;;;;;;;;;;;;;;;;;;;
600;Oishi Panchos Keripik Jagung Pedas;Keripik jagung nazifa rasa pedas manis;3,33333E+15;0;jagung,minyak nabati,gula,maltodekstrin,garam,cabai,bumbu rasa bbq,bubuk bawang putih,bubuk bawang bombay,penguat rasa,perisa sintetik jagung,perisa alami;jagung; minyak nabati; gula; maltodekstrin; garam; cabe; bumbu rasa bbq; bubuk bawang putih; bubuk bawang bombay; penguat rasa; perisa sintetik jagung; perisa alami;;;;;;;;;;;;;;;;;;;;;;;;;
603;Chiki Snack Balls Chicken;Chicken snack go chick;3,33333E+15;0;kosong;kosong;;;;;;;;;;;;;;;;;;;;;;;;;;;;;;;;;;;;
604;Chiki Snack Balls Chicken;Chicken snack go chick;3,33333E+15;0;jagung,minyak olein kelapa sawit,beras,bumbu,garam,gula,penguat rasa mononatrium glutamat,dinatrium guanilat,dinatrium inosinat,minyak,lemak nabati,Asam Askorbat,kedelai,minyak bawang;jagung; minyak olein kelapa sawit; beras; bumbu; garam; gula; penguat rasa mononatrium glutamat; dinatrium guanilat,dinatrium inosinat; minyak,lemak nabati; antioksidan asam askorbat; kedelai; minyak bawang;;;;;;;;;;;;;;;;;;;;;;;;;
605;Monde Snack Spicy Tomato;Emmh snack spicy;3,33333E+15;0;beras,jagung,dekstrosa,minyak nabati,gula,whey bubuk,kecap bubuk,telur bubuk,bumbu tomat pedas,penguat rasa mononatrium glutamat,garam,tomat bubuk,cabai bubuk;beras; jagung; dekstrosa; minyak nabati; gula; whey bubuk; kecap bubuk; telur bubuk; bumbu tomat pedas; penguat rasa mononatrium glutamat; garam; tomat bubuk; cabe bubuk;;;;;;;;;;;;;;;;;;;;;;;;
609;Max Creamer Krimer Nabati Non Dairy;Non dairy creamer;3,33333E+15;0;kosong;kosong;;;;;;;;;;;;;;;;;;;;;;;;;;;;;;;;;;;;
610;Chiki Balls Snack Chocolate;Emmh snack chocolate;3,33333E+15;0;jagung,minyak olein kelapa sawit,beras,bumbu,cokelat bubuk,beras,kakao bubuk,perisa sintetik cokelat,perisa sintetik pasta cokelat,;jagung; minyak olein kelapa sawit; beras; bumbu; cokelat bubuk; beras; kakao bubuk; perisa sintetik cokelat; perisa sintetik pasta cokelat; ;;;;;;;;;;;;;;;;;;;;;;;;;;;
611;Kraft Cheese Quick Melt;Cheese melt;3,33333E+15;0;air,keju cheddar,minyak nabati,padatan susu,pengemulsi,garam fosfat,mo,digliserida,garam mineral,maltodesktrin,pengatur keasaman,asam laktat,gula,pengawet,kalium sorbat,vitamin a,vitamin b,susu;air; keju cheddar; minyak nabati; padatan susu; pengemulsi garam fosfat; mono  digliserida; garam mineral; maltodesktrin; pengatur keasaman,asam laktat; gula; pengawet kaliun sorbat; vit a; vit b; susu;;;;;;;;;;;;;;;;;;;;;;;
615;Nissin Biscuit Butter Coconut;Borneo butter coconut;3,33333E+15;0;tepung terigu,gula,minyak nabati,kelapa,mentega,garam,pengembang;tepung terigu; gula; minyak nabati; kelapa; mentega; garam; pengembang;;;;;;;;;;;;;;;;;;;;;;;;;;;;;;
617;Indomaret Mix Nuts;Mix nuts;3,33333E+15;0;kacang koro,kacang tanah,kacang mede,kacang almond,kacang macadamia,gula,garam,minyak nabati,tepung tapioka,bawang putih,daun jeruk purut,ketumbar,madu,penguat rasa mononatrium Glutamat;kacang koro; kacang tanah; kacang mete; kacang almond; kacang macadamia; gula; garam; minyak nabati; tepung tapioka; bawang putih; daun jeruk purut; ketumbar; madu; penguat rasa mononatrium glutamate;;;;;;;;;;;;;;;;;;;;;;;
618;Nextar Strawberry Cookies;Nastar  strawberry;3,33333E+15;0;kosong;kosong;;;;;;;;;;;;;;;;;;;;;;;;;;;;;;;;;;;;
620;Oishi Snack Popcorn Coklat;Popcorn coklat;3,33333E+15;0;gula,jagung berondong,glukosa,lemak susu anhidrat,minyak nabati,krimer nabati,cokelat bubuk,garam,pengemulsi,perisa artifisial cokelat,pengembang,pewarna makanan cokelat ht ci;gula; jagung berondong; glukosa; lemak susu anhidrat; minyak nabati; krimer nabati; coklat bubuk; garam; pengemulsi; perisa artifisial coklat; pengembang,pewarna makanan coklat ht ci;;;;;;;;;;;;;;;;;;;;;;;;;;
623;Mayasi Kacang Jepang Bawang;Kacang bawang primasari;3,33333E+15;0;kacang tanah,pati modifikasi,tepung terigu,gula,minyak kelapa sawit,bumbu rasa bawang,penguat rasa mononatrium glutamat e,Antikempal Silikon Dioksida,bawang putih,pengembang Amonium Bikarbonat,garam,penguat rasa mononatrium glutamat e;kacang tanah; pati modifikasi; tepung terigu; gula; minyak kelapa sawit; bumbu rasa bawang penguat rasa mononatrium glutamat e; antikempal silikon dioksida e; bawang putih; pengembang amonium bikarbonat; garam; penguat rasa monontarium glutamat e;;;;;;;;;;;;;;;;;;;;;;;;;;
624;Buavita Juice Slim Mangga;Juice mangga;3,33333E+15;0;sari buah mangga,sukrosa,perisa mangga,vitamin c,pemantap,pewarna alami anato,ci ;sari buah mangga; sukrosa; perisa mangga; vitamin c; pemantap; pewarna alami anato ci ;;;;;;;;;;;;;;;;;;;;;;;;;;;;;;;
625;Aik Cheong Kopi O;Es kopi o;3,33333E+15;0;biji kopi,gula,marjerin,garam;biji kopi; gula; marjerin,garam;;;;;;;;;;;;;;;;;;;;;;;;;;;;;;;;;;
629;Diamond Juice Unsweet Sirsak;Juice sirsak;3,33333E+15;0;air,pure sirsak,pengatur keasaman,asam sitrat,perisa alami sirsak;air; pure sirsak; pengatur keasaman,asam sitrat; perisa alami sirsak;;;;;;;;;;;;;;;;;;;;;;;;;;;;;;;;;
630;Air Mancur Madurasa Original;Air mancur  kelmarks;3,33333E+15;0;fruktosa,glukosa,madu,air demineral,perisa identik alami madu,pewarna karamel iii amonia proses,karomoisin ci;fruktosa; glukosa; madu ; air demineral; perisa identik alami madu; pewarna karamel iii amonia proses; karomoisin ci;;;;;;;;;;;;;;;;;;;;;;;;;;;;;;
631;Chui Hiang Pistachio Nuts;Ch mixed nuts,150g;3,33333E+15;0;kosong;kosong;;;;;;;;;;;;;;;;;;;;;;;;;;;;;;;;;;;;
633;Potabee Snack Potato Chips Bbq;Hana snack potato bambu rasa bbq;3,33333E+15;0;kentang,minyak kelapa sawit,antioksidan butil hidrokinon tersiertbhq,perisa identik alami sapi panggang,penguat rasa,mononatrium glutamat,dinatrium '- ribonukleotida,ekstrak daging sapi,bubuk lada hitam;kentang; minyak kelapa sawit antioksidan butil hidrokinon tersiertbhq; perisa identik alami sapi panggang penguat rasa mononatrium glutamat; dinatrium  ribonukleotida; ekstrak daging sapi; bubuk lada hitam;;;;;;;;;;;;;;;;;;;;;;;;;;;;;;;
637;Piattos Snack Kentang Kimchi;Kentang stick yosita snack;3,33333E+15;0;tepung kentang,minyak nabati,pati tapioka,bumbu kimchi,gula,garam;tepung kentang ; minyak nabati; pati tapioka; bumbu kimchi; gula; garam;;;;;;;;;;;;;;;;;;;;;;;;;;;;;;;
638;Pia 100 Kue Pia Kacang Hijau;Kue satuh kacang hijau;3,33333E+15;0;gula,tepung terigu,kacang hijau,minyak nabati,sirup glukosa,penstabil nabati,pengembang natrium hidrogen karbonat,pengawet kalsium propionat,garam,perisa alami vanili,pengaturan keasaman asam sitrat;gula; tepung terigu; kacang hijau ; minyak nabati; sirup glukosa; penstabil nabati; pengembang natrium hidrogen karbonat; pengawet kalsium propionat; garam; perisa alami vanili; pengaturan keasaman asam sitrat;;;;;;;;;;;;;;;;;;;;;;;;;;
641;Air Mancur Madurasa Murni;Air mancur  kelmarks;3,33333E+15;0;kosong;kosong;;;;;;;;;;;;;;;;;;;;;;;;;;;;;;;;;;;;
645;Oishi Snack Suky Suky U,g Manis Pedas;Emping mlinjo pedas manis;3,33333E+15;0;tepung terigu,gula,minyak nabati,antioksidan tbhq,tepung tapioka,glukosa,tepung kentang,cabai,penguat rasa,mononatrium glutamat,u,g,bawang putih,pengemulsi lesitin kedelai,pewarna makanan,tartrazin ci,merah allura;tepung terigu; gula; minyak nabati antioksidan tbhq; tepung tapioka; glukosa; tepung kentang; cabe; penguat rasa mononatrium glutamat; u,g; bawang putih; pengemulsi lesitin kedelai; pewarna makanan tartrazin ci ; merah allura;;;;;;;;;;;;;;;;;;;;;;;;
646;Oishi Snack Stick Rin-Bee Keju;Hana snack stick kentang rasa keju;3,33333E+15;0;tepung terigu,tepung tapioka,minyak nabati,antioksidan tbhq,bubuk keju,pewarna kuning fcf ci,gula,gara,penguat rasa,mononatrium glutamat,pewarna makanan,tartrazin cl ;tepung terigu; tepung tapioka; minyak nabati antioksidan tbhq; bubuk keju pewarna kuning fcf cl ; gula; gara; penguat rasa mononatrium glutamat;,pewarna makanan tartrazin cl ;;;;;;;;;;;;;;;;;;;;;;;;;;;;;
647;Crystalline Air Mineral;Air mineral,aqua;3,33333E+15;0;kosong;kosong;;;;;;;;;;;;;;;;;;;;;;;;;;;;;;;;;;;;
648;Indomaret Wafer Stick;Indomaret stick keju;3,33333E+15;0;gula,terigu,minyak nabati,susu bubuk,kakao bubuk,tapioka,kacang mede,multidestrin,lesitin kedelai,pewarna karamel,garam,vanili,pengembang;gula; terigu; minyak nabati; susu bubuk; kakao bubuk; tapioka; kacang mede; multidestrin; lesitin kedelai; pewarna karamel; garam; vanili; pengembang;;;;;;;;;;;;;;;;;;;;;;;;
651;Serena Chocolate Chip Cookies Broniz;Chocolate chip cookies;3,33333E+15;0;kosong;kosong;;;;;;;;;;;;;;;;;;;;;;;;;;;;;;;;;;;;
652;Marjan Syrup Squash Orange;Gambino syrup orange;3,33333E+15;0;air,gula pasir,pengatur keasaman,asam sitrat,sari buah jeruk,perisa jeruk,pemantap nabati,pemanis buatan,pengawet natrium benzoat;air; gula pasir; pengatur keasaman,asam sitrat; sari buah jeruk; perisa jeruk; pemantap nabati; pemanis buatan; pengawet natrium benzoat;;;;;;;;;;;;;;;;;;;;;;;;;;;;;
653;Indofood Syrup Freiss Orange;Gambino syrup orange;3,33333E+15;0;air,gula,pengatur keasaman,perisa jeruk;air; gula; pengatur keasaman; perisa jeruk;;;;;;;;;;;;;;;;;;;;;;;;;;;;;;;;;
654;Dj Minuman Kesehatan Alami Gula Asem;Minuman gula asem jawa;3,33333E+15;0;asem,gula jawa,air;asem; gula jawa; air;;;;;;;;;;;;;;;;;;;;;;;;;;;;;;;;;;
656;Top Coffee Kopi Cappuccino;Coffee roasting kopi abah;3,33333E+15;0;gula,krimer nabati,kopi bubuk,susu skim bubuk,cokelat butir,perisa sintetil cappucino;gula; krimer nabati; kopi bubuk; susu skim bubuk; cokelat butir; perisa sintetil cappucino;;;;;;;;;;;;;;;;;;;;;;;;;;;;;;;
660;Ichi Ocha Minuman Green Tea;Minuman serbuk green tea;3,33333E+15;0;air,gula,daun teh hijau,pengatur keasaman,natrium bikarbonat,kalium karbonat,Asam Askorbat,perisa identik alami melati;air; gula; daun teh hijau; pengatur keasaman,natrium bikarbonat,kalium karbonat; antioksidan asam askorbat; perisa identik alami melati;;;;;;;;;;;;;;;;;;;;;;;;;;;;;;;
661;Nu Minuman Green Tea Original;Minuman serbuk green tea;3,33333E+15;0;air,gula,daun teh hijau,perisa identik alami teh melati;air; gula; daun teh hijau; perisa identik alami teh melati;;;;;;;;;;;;;;;;;;;;;;;;;;;;;;;;;
663;Lemonia Minuman Sari Lemon;Gifta sari lemon;3,33333E+15;0;jeruk lemon;jeruk lemon;;;;;;;;;;;;;;;;;;;;;;;;;;;;;;;;;;;;
664;Mister Potato Snack Crisps Original;Hana snack potato bambu rasa original;3,33333E+15;0;tepung kentang,minyak kelapa sawit,tepung tapioka,dekstrosa,garam,gula,rempah-rempah rempah,penguat rasa mononatrium glutamat,e;tepung kentang; minyak kelapa sawit; tepung tapioka; dekstrosa; garam; gula; rempahrempah,penguat rasa mononatrium glutamat e;;;;;;;;;;;;;;;;;;;;;;;;;;;;;;
669;Verlin Granola Cluster Almond Dark Chocolate;Nutify almond gourmet dark chocolate;3,33333E+15;0;havermut utuh,biji chia,biji flax,kulit gandum beras merah giling,garam laut himalaya,jagung kering giling,madu,gula kelapa,minyak kelapa,rice crispy,dark chocolate;havermut utuh; biji chia; biji flax; kulit gandum beras merah giling; garam laut himalaya; jagung kering giling; madu; gula kelapa; minyak kelapa; rice crispy; dark chocolate;;;;;;;;;;;;;;;;;;;;;;;;;;
670;Frestea Minuman Teh Apel;Minuman teh dalam botol frestea;3,33333E+15;0;air gula,teh,pengatur keasaman,asam sitrat,konsentrat apel,perisa identik alami,Asam Askorbat;air gula; teh ; pengatur keasaman,asam sitrat; konsentrat apel ; perisa identik alami; antioksidan asam askorbat;;;;;;;;;;;;;;;;;;;;;;;;;;;;;;;
671;Frestea Minuman Teh Apel;Minuman teh dalam botol frestea;3,33333E+15;0;air,gula,asam sitrat,konsentrat teh,perisa sari buah apel,vitamin c;air; gula; asam sitrat; konsentrat teh; perisa sari buah apel; vitamin c;;;;;;;;;;;;;;;;;;;;;;;;;;;;;;;
674;Sedaap Mie Instant Soto;Soto mie;3,33333E+15;0;tepung terigu,minyak sayur,garam,pengental nabati,pengatur keasaman,pewarna,tartrazin ci,zat besi,garam,gula,penguat rasa,mononatrium glutamat,perisa ayam,bubuk lada,perisa bawang putih,daun bawamg merah,vitamin a,vitamin b,vitamin b,vitamin b,vitamin b,niasin,asam folat,bubuk cabai,minyak sayur,ramuan soto,serbuk gurih;mi tepung terigu; minyak sayur; garam; pengental nabati; pengatur keasaman; pewarna tartrazin ci ;,zat besi bumbu garam; gula; penguat rasa; mononatrium glutamat; perisa ayam; bubuk lada; perisa bawang putih; daun bawamg merah; vitamin a; b; b; b; b; niasin; asam folat bubuk cabe minyak minyak sayur,ramuan soto serbuk gurih;;;;;;;;;;;;;;;;
